,number,value,datetime_start,datetime_complete,duration,params_activation,params_batch_size,params_d_ff,params_d_model,params_dropout,params_e_layers,params_fc_dropout,params_head_dropout,params_kernel_size,params_learning_rate,params_n_heads,params_patch_len,params_stride,state
133,133,0.7570524835988753,2024-10-10 07:27:51.626189,2024-10-10 07:35:22.743109,0 days 00:07:31.116920,relu,48,128,512,0.1,6,0.4,0.30000000000000004,15,0.0001,4,16,16,COMPLETE
134,134,0.7517561983471074,2024-10-10 07:35:22.757730,2024-10-10 07:48:43.286795,0 days 00:13:20.529065,relu,48,512,512,0.1,6,0.4,0.4,15,0.0001,4,16,16,COMPLETE
135,135,0.7545804814783259,2024-10-10 07:48:43.302474,2024-10-10 08:00:28.167434,0 days 00:11:44.864960,relu,48,256,512,0.1,6,0.4,0.1,15,0.0001,4,16,16,COMPLETE
136,136,0.7657067393712194,2024-10-10 08:00:28.182348,2024-10-10 08:18:04.864582,0 days 00:17:36.682234,relu,48,640,512,0.1,6,0.1,0.2,15,0.0001,4,16,16,COMPLETE
137,137,0.7657067393712194,2024-10-10 08:18:04.879683,2024-10-10 08:35:41.036085,0 days 00:17:36.156402,relu,48,640,512,0.1,6,0.1,0.2,15,0.0001,4,16,16,COMPLETE
138,138,0.6109203563280414,2024-10-10 08:35:41.050881,2024-10-10 09:01:29.544890,0 days 00:25:48.494009,elu,48,640,128,0.1,6,0.1,0.2,25,1e-06,4,16,16,COMPLETE
139,139,0.7574970653110297,2024-10-10 09:01:29.560636,2024-10-10 09:21:18.754322,0 days 00:19:49.193686,relu,48,640,512,0.1,6,0.1,0.2,31,0.0001,4,8,16,COMPLETE
140,140,0.7490649228934139,2024-10-10 09:21:18.769110,2024-10-10 09:29:00.917696,0 days 00:07:42.148586,relu,64,640,512,0.1,6,0.1,0.2,15,0.0001,4,16,16,COMPLETE
141,141,0.6763682987324038,2024-10-10 09:29:00.932724,2024-10-10 09:36:33.835528,0 days 00:07:32.902804,gelu,48,640,256,0.1,5,0.1,0.2,15,1e-05,4,16,16,COMPLETE
