,number,value,datetime_start,datetime_complete,duration,params_activation,params_batch_size,params_d_ff,params_d_model,params_dropout,params_e_layers,params_fc_dropout,params_head_dropout,params_kernel_size,params_learning_rate,params_n_heads,params_patch_len,params_stride,state
0,0,0.644846899169767,2024-10-08 11:52:51.947234,2024-10-08 12:04:35.355400,0 days 00:11:43.408166,elu,16,128,384,0.5,3,0.1,0.2,15,1e-05,16,4,8,COMPLETE
1,1,0.7186840286652845,2024-10-08 12:04:35.372761,2024-10-08 12:15:57.970248,0 days 00:11:22.597487,gelu,64,192,256,0.4,5,0.1,0.30000000000000004,25,0.0005,8,4,8,COMPLETE
2,2,0.7589945850255129,2024-10-08 12:15:57.982338,2024-10-08 12:35:15.201251,0 days 00:19:17.218913,gelu,32,640,384,0.2,5,0.4,0.5,31,0.0001,8,4,4,COMPLETE
3,3,0.6264092423769086,2024-10-08 12:35:15.213372,2024-10-08 12:48:37.290258,0 days 00:13:22.076886,gelu,32,640,512,0.5,6,0.2,0.5,25,1e-05,16,16,4,COMPLETE
4,4,0.7269983101871574,2024-10-08 12:48:37.302431,2024-10-08 13:00:13.975106,0 days 00:11:36.672675,relu,32,320,384,0.30000000000000004,3,0.2,0.4,15,5e-05,32,8,8,COMPLETE
5,5,0.6552080079141935,2024-10-08 13:00:13.988015,2024-10-08 13:31:09.182779,0 days 00:30:55.194764,gelu,48,192,192,0.1,3,0.2,0.5,25,1e-06,32,8,4,COMPLETE
6,6,0.733177960485833,2024-10-08 13:31:09.195564,2024-10-08 13:45:49.270886,0 days 00:14:40.075322,gelu,16,512,256,0.5,3,0.4,0.5,31,0.0005,8,8,8,COMPLETE
7,7,0.7629087264396542,2024-10-08 13:45:49.283767,2024-10-08 13:58:22.411612,0 days 00:12:33.127845,elu,48,640,512,0.1,5,0.1,0.4,31,0.0001,4,16,16,COMPLETE
8,8,,2024-10-08 13:58:22.424505,2024-10-08 14:02:23.544616,0 days 00:04:01.120111,gelu,16,256,192,0.2,3,0.30000000000000004,0.5,15,0.0005,32,8,16,FAIL
9,9,0.7415181572046614,2024-10-08 14:04:36.273046,2024-10-08 14:27:08.368856,0 days 00:22:32.095810,gelu,16,384,384,0.30000000000000004,3,0.4,0.30000000000000004,15,0.0001,8,4,8,COMPLETE
10,10,,2024-10-08 14:27:08.384560,2024-10-08 14:37:22.124542,0 days 00:10:13.739982,relu,32,256,128,0.4,4,0.1,0.4,31,5e-05,8,8,4,FAIL
11,11,0.6528593100640898,2024-10-08 14:53:50.101040,2024-10-08 15:20:12.834274,0 days 00:26:22.733234,gelu,32,192,384,0.4,4,0.30000000000000004,0.2,31,5e-05,8,8,16,COMPLETE
12,12,0.7545804814783259,2024-10-08 15:20:12.850039,2024-10-08 15:31:30.719658,0 days 00:11:17.869619,elu,48,256,512,0.1,6,0.5,0.1,31,0.0001,4,16,16,COMPLETE
13,13,0.6399304668048811,2024-10-08 15:31:30.733049,2024-10-08 15:54:34.947915,0 days 00:23:04.214866,elu,48,640,32,0.2,5,0.4,0.4,31,5e-06,4,16,4,COMPLETE
14,14,0.6947499834332074,2024-10-08 15:54:34.960977,2024-10-08 16:03:14.936013,0 days 00:08:39.975036,relu,64,640,64,0.2,5,0.5,0.4,31,0.0001,4,16,16,COMPLETE
15,15,0.6786685978813439,2024-10-08 16:03:14.949056,2024-10-08 16:22:20.831428,0 days 00:19:05.882372,elu,48,640,128,0.2,4,0.30000000000000004,0.4,31,0.0001,4,4,16,COMPLETE
16,16,0.7404188321831245,2024-10-08 16:22:20.844549,2024-10-08 16:51:30.650000,0 days 00:29:09.805451,elu,32,640,512,0.1,5,0.4,0.5,31,0.0001,8,16,4,COMPLETE
17,17,0.5961279855726904,2024-10-08 16:51:30.662664,2024-10-08 17:21:08.723411,0 days 00:29:38.060747,relu,32,384,128,0.2,6,0.1,0.4,31,1e-06,4,4,16,COMPLETE
18,18,0.6522675205664896,2024-10-08 17:21:08.735975,2024-10-08 18:08:35.885096,0 days 00:47:27.149121,elu,48,512,192,0.1,4,0.30000000000000004,0.5,31,5e-06,32,16,4,COMPLETE
19,19,0.6356861728815806,2024-10-08 18:08:35.897874,2024-10-08 18:14:44.659900,0 days 00:06:08.762026,gelu,64,320,32,0.2,5,0.2,0.30000000000000004,31,0.0001,16,4,16,COMPLETE
20,20,0.7049705111092177,2024-10-08 18:14:44.673234,2024-10-08 18:28:50.218927,0 days 00:14:05.545693,elu,32,256,64,0.30000000000000004,4,0.5,0.4,25,0.0001,8,4,4,COMPLETE
21,21,,2024-10-08 18:28:50.231648,2024-10-08 18:38:54.091138,0 days 00:10:03.859490,relu,48,128,512,0.1,6,0.4,0.2,15,0.0001,4,16,4,FAIL
22,22,0.7754380733293573,2024-10-08 18:38:54.101581,2024-10-08 19:05:14.086153,0 days 00:26:19.984572,relu,48,128,512,0.1,6,0.4,0.2,15,0.0001,4,16,16,COMPLETE
23,23,0.679181458445751,2024-10-08 19:05:14.098756,2024-10-08 19:16:42.654586,0 days 00:11:28.555830,relu,48,128,512,0.1,6,0.30000000000000004,0.2,15,5e-06,4,16,16,COMPLETE
24,24,0.7614046983423741,2024-10-08 19:16:42.667977,2024-10-08 19:29:40.541292,0 days 00:12:57.873315,relu,48,128,512,0.1,6,0.4,0.1,15,0.0001,4,16,16,COMPLETE
25,25,0.7614046983423741,2024-10-08 19:29:40.554187,2024-10-08 19:42:39.841377,0 days 00:12:59.287190,relu,48,128,512,0.1,6,0.4,0.1,15,0.0001,4,16,16,COMPLETE
26,26,0.7614046983423741,2024-10-08 19:42:39.854859,2024-10-08 19:55:40.865994,0 days 00:13:01.011135,relu,48,128,512,0.1,6,0.5,0.1,15,0.0001,4,16,16,COMPLETE
27,27,0.7754380733293573,2024-10-08 19:55:40.879312,2024-10-08 20:22:02.712896,0 days 00:26:21.833584,relu,48,128,512,0.1,6,0.4,0.2,15,0.0001,4,16,16,COMPLETE
28,28,0.6599320288167524,2024-10-08 20:22:02.726303,2024-10-08 20:29:52.396215,0 days 00:07:49.669912,relu,48,128,512,0.2,6,0.30000000000000004,0.2,15,1e-05,4,16,16,COMPLETE
29,29,0.61963235920593,2024-10-08 20:29:52.409599,2024-10-08 20:32:02.521454,0 days 00:02:10.111855,relu,48,128,512,0.1,5,0.5,0.2,15,0.0005,4,16,16,COMPLETE
30,30,0.6006713101019568,2024-10-08 20:32:02.534185,2024-10-08 20:53:18.502726,0 days 00:21:15.968541,relu,48,128,512,0.4,6,0.4,0.30000000000000004,15,1e-06,4,16,16,COMPLETE
31,31,0.7169278303181772,2024-10-08 20:53:18.515690,2024-10-08 21:06:08.990066,0 days 00:12:50.474376,relu,48,320,512,0.2,5,0.2,0.2,15,5e-05,4,16,16,COMPLETE
32,32,0.6856564709891795,2024-10-08 21:06:09.003619,2024-10-08 21:45:26.749738,0 days 00:39:17.746119,elu,16,128,32,0.1,6,0.1,0.30000000000000004,15,1e-05,16,16,16,COMPLETE
33,33,0.6916083278899585,2024-10-08 21:45:26.762521,2024-10-08 21:54:45.974362,0 days 00:09:19.211841,elu,48,256,64,0.1,6,0.30000000000000004,0.2,15,0.0001,4,16,16,COMPLETE
34,34,0.7614046983423741,2024-10-08 21:54:45.987240,2024-10-08 22:07:51.032355,0 days 00:13:05.045115,relu,48,128,512,0.1,6,0.4,0.1,15,0.0001,4,16,16,COMPLETE
35,35,0.7614046983423741,2024-10-08 22:07:51.045639,2024-10-08 22:20:55.976797,0 days 00:13:04.931158,relu,48,128,512,0.1,6,0.4,0.1,15,0.0001,4,16,16,COMPLETE
36,36,0.6816295570513002,2024-10-08 22:20:55.990379,2024-10-08 22:31:04.543004,0 days 00:10:08.552625,relu,64,128,256,0.2,5,0.4,0.1,15,0.0001,4,16,16,COMPLETE
37,37,0.7515815370196814,2024-10-08 22:31:04.556428,2024-10-08 22:41:12.147763,0 days 00:10:07.591335,relu,48,128,512,0.1,6,0.1,0.2,25,0.0001,16,16,8,COMPLETE
38,38,0.7614857572917554,2024-10-08 22:41:12.160749,2024-10-08 22:57:00.646010,0 days 00:15:48.485261,relu,48,384,512,0.2,5,0.5,0.30000000000000004,15,0.0005,32,16,16,COMPLETE
39,39,0.7125216551645792,2024-10-08 22:57:00.658860,2024-10-08 23:35:46.843924,0 days 00:38:46.185064,relu,16,384,192,0.2,5,0.5,0.30000000000000004,25,0.0005,32,8,16,COMPLETE
40,40,,2024-10-08 23:35:46.857571,2024-10-08 23:40:53.566913,0 days 00:05:06.709342,relu,48,384,128,0.2,5,0.5,0.30000000000000004,15,0.0005,32,16,8,FAIL
41,41,,2024-10-09 13:00:55.798099,2024-10-09 14:27:24.317972,0 days 01:26:28.519873,relu,48,384,128,0.2,4,0.5,0.30000000000000004,15,0.0005,32,16,8,FAIL
42,42,0.6513008482197797,2024-10-09 14:27:32.870109,2024-10-09 14:40:20.273152,0 days 00:12:47.403043,relu,48,384,128,0.2,4,0.5,0.30000000000000004,15,0.0005,32,16,8,COMPLETE
43,43,0.7172452027302074,2024-10-09 14:40:20.289650,2024-10-09 14:49:03.031674,0 days 00:08:42.742024,elu,64,384,256,0.4,5,0.5,0.30000000000000004,15,0.0005,32,8,16,COMPLETE
44,44,0.7538542642924086,2024-10-09 14:49:03.045525,2024-10-09 15:01:04.363284,0 days 00:12:01.317759,relu,48,192,512,0.30000000000000004,5,0.2,0.2,25,0.0005,32,16,8,COMPLETE
45,45,0.6849586540191038,2024-10-09 15:01:04.377171,2024-10-09 15:13:56.357765,0 days 00:12:51.980594,gelu,16,512,384,0.2,5,0.1,0.4,15,5e-05,32,8,16,COMPLETE
46,46,0.7368921170467562,2024-10-09 15:13:56.371833,2024-10-09 15:25:21.246388,0 days 00:11:24.874555,relu,48,640,512,0.1,6,0.4,0.1,15,0.0001,4,16,16,COMPLETE
47,47,0.7084280007194721,2024-10-09 15:25:21.259489,2024-10-09 15:36:45.503189,0 days 00:11:24.243700,relu,48,384,512,0.1,6,0.4,0.2,15,1e-05,4,16,16,COMPLETE
48,48,0.6144674249524297,2024-10-09 15:36:45.516981,2024-10-09 16:00:00.719820,0 days 00:23:15.202839,relu,48,640,512,0.1,6,0.4,0.30000000000000004,15,1e-06,32,16,16,COMPLETE
49,49,0.7060440392680318,2024-10-09 16:00:00.733658,2024-10-09 16:10:44.141602,0 days 00:10:43.407944,relu,48,192,512,0.1,5,0.30000000000000004,0.2,15,0.0001,16,16,16,COMPLETE
50,50,,2024-10-09 16:10:44.155741,2024-10-09 16:12:08.520628,0 days 00:01:24.364887,relu,48,128,512,0.1,6,0.4,0.4,15,0.0005,4,16,16,FAIL
51,51,0.6341300777219241,2024-10-09 16:12:08.531639,2024-10-09 16:13:56.633824,0 days 00:01:48.102185,relu,48,320,512,0.1,6,0.4,0.4,15,0.0005,4,16,16,COMPLETE
52,52,0.6535970056705764,2024-10-09 16:13:56.647712,2024-10-09 16:19:36.584147,0 days 00:05:39.936435,elu,48,128,192,0.2,4,0.5,0.1,31,0.0001,4,16,4,COMPLETE
53,53,0.6742663277574243,2024-10-09 16:19:36.597461,2024-10-09 16:36:32.663171,0 days 00:16:56.065710,gelu,48,512,256,0.1,5,0.4,0.30000000000000004,31,5e-06,8,16,8,COMPLETE
54,54,0.7162701286529778,2024-10-09 16:36:32.677112,2024-10-09 16:50:57.908774,0 days 00:14:25.231662,relu,32,640,384,0.2,6,0.30000000000000004,0.5,15,0.0001,4,4,16,COMPLETE
55,55,0.6564956026999139,2024-10-09 16:50:57.922057,2024-10-09 17:00:06.312382,0 days 00:09:08.390325,elu,64,384,128,0.5,3,0.5,0.2,31,5e-05,32,8,16,COMPLETE
56,56,0.6667581390285232,2024-10-09 17:00:06.326391,2024-10-09 17:11:19.398437,0 days 00:11:13.072046,relu,48,256,32,0.1,5,0.2,0.4,25,0.0001,4,16,4,COMPLETE
57,57,0.7614046983423741,2024-10-09 17:11:19.412539,2024-10-09 17:24:16.919489,0 days 00:12:57.506950,relu,48,128,512,0.1,6,0.4,0.1,15,0.0001,4,16,16,COMPLETE
58,58,0.7614046983423741,2024-10-09 17:24:16.933553,2024-10-09 17:37:15.545347,0 days 00:12:58.611794,relu,48,128,512,0.1,6,0.4,0.1,15,0.0001,4,16,16,COMPLETE
59,59,0.7547315942934499,2024-10-09 17:37:15.559560,2024-10-09 17:52:18.718392,0 days 00:15:03.158832,relu,48,128,512,0.30000000000000004,6,0.30000000000000004,0.1,15,0.0001,4,16,16,COMPLETE
60,60,0.7614046983423741,2024-10-09 17:52:18.731832,2024-10-09 18:05:18.660674,0 days 00:12:59.928842,relu,48,128,512,0.1,6,0.4,0.1,15,0.0001,4,16,16,COMPLETE
61,61,0.6620016945462119,2024-10-09 18:05:18.674570,2024-10-09 18:15:36.204957,0 days 00:10:17.530387,gelu,48,640,64,0.1,6,0.5,0.1,15,0.0001,8,4,16,COMPLETE
62,62,0.618754555867958,2024-10-09 18:15:36.219108,2024-10-09 18:51:21.844973,0 days 00:35:45.625865,elu,32,128,512,0.2,6,0.4,0.2,31,1e-06,4,16,16,COMPLETE
63,63,0.7106079539537834,2024-10-09 18:51:21.858490,2024-10-09 19:34:19.552857,0 days 00:42:57.694367,relu,16,192,512,0.1,4,0.30000000000000004,0.1,15,5e-06,4,16,16,COMPLETE
64,64,0.6991445618320034,2024-10-09 19:34:19.566413,2024-10-09 19:45:09.082656,0 days 00:10:49.516243,relu,48,128,512,0.1,5,0.4,0.2,15,1e-05,16,16,16,COMPLETE
65,65,0.7286766446091657,2024-10-09 19:45:09.097083,2024-10-09 19:59:28.563175,0 days 00:14:19.466092,elu,48,320,512,0.2,6,0.5,0.5,31,0.0001,4,16,4,COMPLETE
66,66,,2024-10-09 19:59:28.577339,2024-10-09 20:01:13.425721,0 days 00:01:44.848382,relu,48,384,192,0.1,5,0.4,0.30000000000000004,15,0.0005,4,4,16,FAIL
67,67,,2024-10-09 20:01:13.437711,2024-10-09 20:02:59.480297,0 days 00:01:46.042586,relu,48,384,192,0.1,5,0.4,0.30000000000000004,15,0.0005,4,4,16,FAIL
68,68,,2024-10-09 20:02:59.492206,2024-10-09 20:04:45.274956,0 days 00:01:45.782750,relu,48,384,192,0.1,5,0.4,0.30000000000000004,15,0.0005,4,4,16,FAIL
69,69,0.47767376198725775,2024-10-09 20:04:45.286545,2024-10-09 20:06:07.266516,0 days 00:01:21.979971,relu,48,384,512,0.1,5,0.4,0.30000000000000004,15,0.0005,4,4,16,COMPLETE
70,70,0.7614046983423741,2024-10-09 20:06:07.280850,2024-10-09 20:19:13.508659,0 days 00:13:06.227809,relu,48,128,512,0.1,6,0.5,0.1,15,0.0001,4,16,16,COMPLETE
71,71,0.7614046983423741,2024-10-09 20:19:13.522404,2024-10-09 20:32:19.785578,0 days 00:13:06.263174,relu,48,128,512,0.1,6,0.5,0.1,15,0.0001,4,16,16,COMPLETE
72,72,0.7614046983423741,2024-10-09 20:32:19.853176,2024-10-09 20:45:25.241191,0 days 00:13:05.388015,relu,48,128,512,0.1,6,0.5,0.1,15,0.0001,4,16,16,COMPLETE
73,73,0.7411333342800073,2024-10-09 20:45:25.255572,2024-10-09 20:55:43.688176,0 days 00:10:18.432604,relu,48,128,32,0.1,6,0.5,0.4,15,0.0001,4,16,16,COMPLETE
74,74,0.6997907850766332,2024-10-09 20:55:43.701694,2024-10-09 21:05:05.125378,0 days 00:09:21.423684,relu,48,128,192,0.1,6,0.2,0.1,15,0.0001,4,16,16,COMPLETE
75,75,0.7036393693258736,2024-10-09 21:05:05.139010,2024-10-09 21:19:53.116482,0 days 00:14:47.977472,relu,64,256,64,0.2,6,0.4,0.2,15,0.0001,32,16,16,COMPLETE
76,76,0.7272134418221579,2024-10-09 21:19:53.130820,2024-10-09 21:31:56.329186,0 days 00:12:03.198366,elu,48,640,512,0.1,6,0.5,0.2,31,5e-05,8,16,8,COMPLETE
77,77,0.6217259284503897,2024-10-09 21:31:56.343583,2024-10-09 21:33:00.265861,0 days 00:01:03.922278,gelu,32,512,384,0.1,5,0.4,0.1,25,0.0005,4,8,16,COMPLETE
78,78,0.7364765272216068,2024-10-09 21:33:00.279657,2024-10-09 21:55:01.083531,0 days 00:22:00.803874,relu,16,128,128,0.30000000000000004,6,0.5,0.4,15,0.0001,4,16,16,COMPLETE
79,79,0.6081438802268231,2024-10-09 21:55:01.097619,2024-10-09 22:17:08.369704,0 days 00:22:07.272085,relu,48,128,512,0.2,5,0.4,0.30000000000000004,15,1e-06,16,16,16,COMPLETE
80,80,0.7614046983423741,2024-10-09 22:17:08.384352,2024-10-09 22:30:19.621731,0 days 00:13:11.237379,relu,48,128,512,0.1,6,0.4,0.1,15,0.0001,4,16,16,COMPLETE
81,81,0.7614046983423741,2024-10-09 22:30:19.635848,2024-10-09 22:43:28.731517,0 days 00:13:09.095669,relu,48,128,512,0.1,6,0.30000000000000004,0.1,15,0.0001,4,16,16,COMPLETE
82,82,0.7614046983423741,2024-10-09 22:43:28.746189,2024-10-09 22:56:38.701840,0 days 00:13:09.955651,relu,48,128,512,0.1,6,0.4,0.1,15,0.0001,4,16,16,COMPLETE
83,83,0.7125311219031931,2024-10-09 22:56:38.715792,2024-10-09 23:15:57.737556,0 days 00:19:19.021764,relu,48,384,256,0.1,6,0.4,0.1,15,0.0001,32,16,16,COMPLETE
84,84,0.6935062906478089,2024-10-09 23:15:57.752041,2024-10-09 23:27:34.486581,0 days 00:11:36.734540,relu,48,128,512,0.1,6,0.4,0.2,15,1e-05,4,16,16,COMPLETE
85,85,0.6734065112228187,2024-10-09 23:27:34.500630,2024-10-09 23:46:46.536412,0 days 00:19:12.035782,relu,48,640,512,0.1,4,0.30000000000000004,0.1,15,5e-06,4,16,8,COMPLETE
86,86,0.7152341124459213,2024-10-09 23:46:46.550412,2024-10-09 23:56:40.515260,0 days 00:09:53.964848,elu,48,128,512,0.2,6,0.1,0.1,15,0.0001,4,16,4,COMPLETE
87,87,0.7358943227968532,2024-10-09 23:56:40.529265,2024-10-10 00:10:48.597853,0 days 00:14:08.068588,relu,64,192,512,0.1,6,0.5,0.2,31,0.0005,32,8,16,COMPLETE
88,88,0.6774669137485445,2024-10-10 00:10:48.612679,2024-10-10 00:21:48.086590,0 days 00:10:59.473911,relu,48,320,192,0.1,6,0.4,0.2,25,0.0001,4,4,16,COMPLETE
89,89,0.7509833574735167,2024-10-10 00:21:48.100636,2024-10-10 00:33:16.285039,0 days 00:11:28.184403,gelu,48,384,512,0.2,5,0.4,0.30000000000000004,15,0.0001,4,16,16,COMPLETE
90,90,0.7614046983423741,2024-10-10 00:33:16.299645,2024-10-10 00:46:28.218697,0 days 00:13:11.919052,relu,48,128,512,0.1,6,0.4,0.1,15,0.0001,4,16,16,COMPLETE
91,91,0.7614046983423741,2024-10-10 00:46:28.233537,2024-10-10 00:59:39.620194,0 days 00:13:11.386657,relu,48,128,512,0.1,6,0.4,0.1,15,0.0001,4,16,16,COMPLETE
92,92,0.7614046983423741,2024-10-10 00:59:39.634893,2024-10-10 01:12:52.626872,0 days 00:13:12.991979,relu,48,128,512,0.1,6,0.4,0.1,15,0.0001,4,16,16,COMPLETE
93,93,0.7614046983423741,2024-10-10 01:12:52.641822,2024-10-10 01:26:06.798103,0 days 00:13:14.156281,relu,48,128,512,0.1,6,0.30000000000000004,0.1,15,0.0001,4,16,16,COMPLETE
94,94,0.7343878096806868,2024-10-10 01:26:06.811938,2024-10-10 01:44:14.502321,0 days 00:18:07.690383,relu,48,128,32,0.1,6,0.4,0.1,15,0.0001,8,16,16,COMPLETE
95,95,0.6243564984427216,2024-10-10 01:44:14.516371,2024-10-10 01:45:42.391928,0 days 00:01:27.875557,elu,16,512,384,0.1,6,0.5,0.1,31,0.0005,4,16,16,COMPLETE
96,96,0.7090892524116517,2024-10-10 01:45:42.405873,2024-10-10 02:04:46.693614,0 days 00:19:04.287741,relu,32,256,128,0.1,6,0.4,0.1,15,5e-05,32,16,16,COMPLETE
97,97,0.7605667736408129,2024-10-10 02:04:46.708694,2024-10-10 02:22:11.570893,0 days 00:17:24.862199,relu,48,640,512,0.1,6,0.5,0.4,15,0.0001,16,16,16,COMPLETE
98,98,0.5857555167419273,2024-10-10 02:22:11.585134,2024-10-10 02:42:33.228973,0 days 00:20:21.643839,relu,48,128,64,0.4,5,0.4,0.2,15,1e-06,4,16,4,COMPLETE
99,99,0.731929415996895,2024-10-10 02:42:33.243891,2024-10-10 02:52:01.663334,0 days 00:09:28.419443,elu,48,384,256,0.2,3,0.30000000000000004,0.1,31,0.0001,4,16,8,COMPLETE
100,100,0.7614046983423741,2024-10-10 02:52:01.678726,2024-10-10 03:05:15.862782,0 days 00:13:14.184056,relu,48,128,512,0.1,6,0.4,0.1,15,0.0001,4,16,16,COMPLETE
101,101,0.7614046983423741,2024-10-10 03:05:15.877164,2024-10-10 03:18:31.648363,0 days 00:13:15.771199,relu,48,128,512,0.1,6,0.4,0.1,15,0.0001,4,16,16,COMPLETE
102,102,0.7614046983423741,2024-10-10 03:18:31.662547,2024-10-10 03:31:44.717724,0 days 00:13:13.055177,relu,48,128,512,0.1,6,0.4,0.1,15,0.0001,4,16,16,COMPLETE
103,103,0.7614046983423741,2024-10-10 03:31:44.731688,2024-10-10 03:45:02.637825,0 days 00:13:17.906137,relu,48,128,512,0.1,6,0.4,0.1,15,0.0001,4,16,16,COMPLETE
104,104,0.6860660257684625,2024-10-10 03:45:02.652840,2024-10-10 03:56:45.815278,0 days 00:11:43.162438,relu,48,128,512,0.1,6,0.4,0.30000000000000004,15,1e-05,4,16,16,COMPLETE
105,105,0.6660839889049824,2024-10-10 03:56:45.829624,2024-10-10 04:07:25.410338,0 days 00:10:39.580714,relu,48,128,512,0.1,6,0.4,0.1,25,5e-06,4,4,16,COMPLETE
106,106,0.6804050344115948,2024-10-10 04:07:25.425283,2024-10-10 04:17:03.873880,0 days 00:09:38.448597,relu,64,640,512,0.5,4,0.2,0.5,15,0.0001,32,8,16,COMPLETE
107,107,,2024-10-10 04:17:03.888814,2024-10-10 04:19:33.085709,0 days 00:02:29.196895,gelu,48,128,512,0.1,6,0.5,0.1,15,0.0005,4,16,16,FAIL
108,108,,2024-10-10 04:19:33.097840,2024-10-10 04:22:02.066205,0 days 00:02:28.968365,gelu,48,128,512,0.1,6,0.5,0.1,15,0.0005,4,16,16,FAIL
109,109,,2024-10-10 04:22:02.078400,2024-10-10 04:24:30.839063,0 days 00:02:28.760663,gelu,48,128,512,0.1,6,0.5,0.1,15,0.0005,4,16,16,FAIL
110,110,,2024-10-10 04:24:30.851128,2024-10-10 04:26:59.447407,0 days 00:02:28.596279,gelu,48,128,512,0.1,6,0.5,0.1,15,0.0005,4,16,16,FAIL
111,111,,2024-10-10 04:26:59.460152,2024-10-10 04:29:28.330465,0 days 00:02:28.870313,relu,48,128,512,0.1,6,0.5,0.1,15,0.0005,4,16,16,FAIL
112,112,,2024-10-10 04:29:28.343246,2024-10-10 04:31:57.111321,0 days 00:02:28.768075,gelu,48,128,512,0.1,6,0.5,0.1,15,0.0005,4,16,16,FAIL
113,113,,2024-10-10 04:31:57.124444,2024-10-10 04:34:24.737378,0 days 00:02:27.612934,relu,48,128,512,0.1,6,0.5,0.1,15,0.0005,4,16,16,FAIL
114,114,,2024-10-10 04:34:24.749507,2024-10-10 04:36:54.160440,0 days 00:02:29.410933,gelu,48,128,512,0.1,6,0.5,0.1,15,0.0005,4,16,16,FAIL
115,115,,2024-10-10 04:36:54.172501,2024-10-10 04:39:22.537294,0 days 00:02:28.364793,gelu,48,128,512,0.1,6,0.5,0.1,15,0.0005,4,16,16,FAIL
116,116,,2024-10-10 04:39:22.549815,2024-10-10 04:41:50.475193,0 days 00:02:27.925378,gelu,48,128,512,0.1,6,0.5,0.1,15,0.0005,4,16,16,FAIL
117,117,,2024-10-10 04:41:50.487336,2024-10-10 04:44:19.450462,0 days 00:02:28.963126,gelu,48,128,512,0.1,6,0.5,0.1,15,0.0005,4,16,16,FAIL
118,118,,2024-10-10 04:44:19.462737,2024-10-10 04:46:47.454379,0 days 00:02:27.991642,relu,48,128,512,0.1,6,0.5,0.1,15,0.0005,4,16,16,FAIL
119,119,,2024-10-10 04:46:47.466548,2024-10-10 04:49:15.858755,0 days 00:02:28.392207,gelu,48,128,512,0.1,6,0.5,0.1,15,0.0005,4,16,16,FAIL
120,120,0.7614046983423741,2024-10-10 04:49:15.871844,2024-10-10 05:02:34.367992,0 days 00:13:18.496148,gelu,48,128,512,0.1,6,0.5,0.1,15,0.0001,4,16,16,COMPLETE
121,121,0.6273001808147075,2024-10-10 05:02:34.383257,2024-10-10 05:03:54.262870,0 days 00:01:19.879613,relu,48,192,512,0.1,6,0.4,0.2,15,0.0005,4,16,16,COMPLETE
122,122,0.7229008690466047,2024-10-10 05:03:54.278233,2024-10-10 05:19:25.894383,0 days 00:15:31.616150,relu,48,320,512,0.30000000000000004,5,0.5,0.1,15,0.0001,8,16,16,COMPLETE
123,123,0.7614046983423741,2024-10-10 05:19:25.908943,2024-10-10 05:32:44.330163,0 days 00:13:18.421220,relu,48,128,512,0.1,6,0.4,0.1,15,0.0001,4,16,16,COMPLETE
124,124,0.7614046983423741,2024-10-10 05:32:44.344798,2024-10-10 05:46:04.408101,0 days 00:13:20.063303,relu,48,128,512,0.1,6,0.4,0.1,15,0.0001,4,16,16,COMPLETE
125,125,0.7614046983423741,2024-10-10 05:46:04.422752,2024-10-10 05:59:23.566280,0 days 00:13:19.143528,relu,48,128,512,0.1,6,0.4,0.1,15,0.0001,4,16,16,COMPLETE
126,126,0.7614046983423741,2024-10-10 05:59:23.581034,2024-10-10 06:12:43.260803,0 days 00:13:19.679769,relu,48,128,512,0.1,6,0.4,0.1,15,0.0001,4,16,16,COMPLETE
127,127,0.7374544413204207,2024-10-10 06:12:43.276411,2024-10-10 06:28:14.976906,0 days 00:15:31.700495,elu,16,128,192,0.1,6,0.4,0.1,31,0.0001,4,16,16,COMPLETE
128,128,0.7655652116289416,2024-10-10 06:28:14.992150,2024-10-10 06:43:08.981188,0 days 00:14:53.989038,relu,48,384,512,0.1,6,0.4,0.30000000000000004,15,0.0001,4,16,16,COMPLETE
129,129,0.739157744265523,2024-10-10 06:43:08.995778,2024-10-10 07:02:21.381212,0 days 00:19:12.385434,relu,32,384,512,0.1,6,0.30000000000000004,0.30000000000000004,15,5e-05,16,16,16,COMPLETE
130,130,0.7178373472305056,2024-10-10 07:02:21.396219,2024-10-10 07:10:52.376032,0 days 00:08:30.979813,relu,48,384,384,0.1,6,0.4,0.30000000000000004,15,0.0001,4,16,4,COMPLETE
131,131,0.6787961621841659,2024-10-10 07:10:52.391440,2024-10-10 07:19:52.401706,0 days 00:09:00.010266,relu,48,384,32,0.2,6,0.5,0.30000000000000004,15,0.0005,32,16,16,COMPLETE
132,132,0.6734024878589078,2024-10-10 07:19:52.416556,2024-10-10 07:27:51.611267,0 days 00:07:59.194711,relu,48,384,64,0.1,6,0.2,0.30000000000000004,15,0.0001,4,4,8,COMPLETE
